{"$schema":"https://json-schema.org/draft/2020-12/schema","$id":"https://github.com/rezahh107/PR-Inspector/schemas/aigov/v2.5.0/repository_review_policy.schema.json","title":"AIGOV Inactive Repository Review Policy Contract","description":"Inactive, non-authoritative AIGOV v2.5.0 contract carrier.","type":"object","additionalProperties":false,"properties":{"contract_type":{"const":"repository_review_policy"},"contract_version":{"const":"1.0"},"policy":{"$ref":"common.schema.json#/$defs/policy_reference"},"repository":{"$ref":"common.schema.json#/$defs/repository_identity"},"lifecycle_state":{"$ref":"common.schema.json#/$defs/policy_lifecycle"},"minimum_inspection_profile":{"$ref":"common.schema.json#/$defs/inspection_profile"},"minimum_evidence_profile":{"$ref":"common.schema.json#/$defs/evidence_profile"},"receipt_publication_required":{"type":"boolean"},"publication_authority_reference":{"anyOf":[{"$ref":"common.schema.json#/$defs/authority_reference"},{"type":"null"}]},"merge_readiness_authority":{"enum":["none","owner_only","owner_with_repository_enforcement"]},"repository_enforcement_claim":{"enum":["not_claimed","configured","verified","unresolved"]},"repository_enforcement_evidence":{"anyOf":[{"$ref":"common.schema.json#/$defs/evidence_reference"},{"type":"null"}]},"effective_transition_reference":{"anyOf":[{"$ref":"common.schema.json#/$defs/record_reference"},{"type":"null"}]},"fail_closed_on_missing_evidence":{"const":true}},"required":["contract_type","contract_version","policy","repository","lifecycle_state","minimum_inspection_profile","minimum_evidence_profile","receipt_publication_required","publication_authority_reference","merge_readiness_authority","repository_enforcement_claim","repository_enforcement_evidence","effective_transition_reference","fail_closed_on_missing_evidence"],"allOf":[{"if":{"properties":{"lifecycle_state":{"const":"active"}},"required":["lifecycle_state"]},"then":{"properties":{"effective_transition_reference":{"$ref":"common.schema.json#/$defs/record_reference"}}}},{"if":{"properties":{"receipt_publication_required":{"const":true}},"required":["receipt_publication_required"]},"then":{"properties":{"publication_authority_reference":{"$ref":"common.schema.json#/$defs/authority_reference"}}}},{"if":{"properties":{"repository_enforcement_claim":{"const":"verified"}},"required":["repository_enforcement_claim"]},"then":{"properties":{"repository_enforcement_evidence":{"$ref":"common.schema.json#/$defs/evidence_reference"}}}},{"if":{"properties":{"lifecycle_state":{"enum":["candidate","trial","inactive"]}},"required":["lifecycle_state"]},"then":{"not":{"properties":{"repository_enforcement_claim":{"const":"verified"}},"required":["repository_enforcement_claim"]}}}]}