{"contract_type":"repository_review_policy","contract_version":"1.0","effective_transition_reference":{"record_digest":"sha256:dddddddddddddddddddddddddddddddddddddddddddddddddddddddddddddddd","record_id":"transition-1","record_type":"policy_transition_record"},"fail_closed_on_missing_evidence":true,"lifecycle_state":"trial","merge_readiness_authority":"owner_only","minimum_evidence_profile":"standard","minimum_inspection_profile":"standard","policy":{"policy_digest":"sha256:cccccccccccccccccccccccccccccccccccccccccccccccccccccccccccccccc","policy_id":"repo-review-policy","policy_version":"1.0.0"},"publication_authority_reference":{"authority_id":"AIGOV-PUB-001","authority_kind":"repository_policy","source_digest":"sha256:cccccccccccccccccccccccccccccccccccccccccccccccccccccccccccccccc","source_path":"governance/aigov/v2.5.0/PR_INSPECTOR_REVIEW_RECEIPT_PUBLICATION_CONTRACT_v1.2.0.fa.md"},"receipt_publication_required":true,"repository":{"repository_full_name":"rezahh107/example-repo","repository_id":123456},"repository_enforcement_claim":"configured","repository_enforcement_evidence":{"evidence_id":"ev-policy-enforcement","evidence_type":"structured_record","retrieval_method":"github_api","source_digest":"sha256:bbbbbbbbbbbbbbbbbbbbbbbbbbbbbbbbbbbbbbbbbbbbbbbbbbbbbbbbbbbbbbbb","target":{"head_sha":"aaaaaaaaaaaaaaaaaaaaaaaaaaaaaaaaaaaaaaaa","pr_number":7,"repository":{"repository_full_name":"rezahh107/example-repo","repository_id":123456}}}}